Thread_name,Thread_url,Thread_Content
"Dear parents of gamers, part 1 league of legends.",https://www.cybersmile.org/cyberbullying-support-community/topic/dear-parents-of-gamers-part-1-league-of-legends_85/,"So I know a lot of parents are unsure about certain games and I've seen several topics about unsure parents asking Cybersmile for advice on the games their children play; to be honest all games can be more 'dangerous' than others and there is no way to round up all games into one sentence that comforts parents on the games their children play. I'm going to be listing all of the games that I have experience on as a gamer (that I can, I'm only human) to give some as truthful as possible advice on the ones I have played, lets get started.
-League of legends, AKA: LOL
League of legends by far is the game I play the most and the one I enjoy the most, unfortunately it is not the friendliest and usually has people around the age of 12 and up on it. The community is not anywhere close to friendly and has a very poor way of dealing with internet trolls on their end. But they do however provides some tools that can help extremely, most commonly being the mute button allowing you to mute any offensive player that may be hindering your gaming experience there is the option to switch chat off entirely too. The best solution for this game is to keep an eye on your child who plays this but make sure (s)he is comfortable in the current environment they are playing in (try not to crack down too hard on this because nobody likes people breathing over your shoulder :p)
some things that parents should know about league:
The game is not pauseable.
Leaving the game will result in a form of punishment upon the player.
An average game of league takes anywhere from 20 min to 40 min.
and finally the game can suck up your savings account faster than a hoover sucks up dust if you let it.
I'll be posting about Minecraft next, Until then stay safe gamers ^_^."
Anonymity on the internet,https://www.cybersmile.org/cyberbullying-support-community/topic/anonymity-on-the-internet_90/,The right/choice of anonymity online is not only a very disputed subject but also hugely important too. Freedom of speech is one of the most important aspects of modern life but where does it stop? Where is the line between freedom of speech and abuse? Will people abusing our freedom of speech ultimately cost us the right to anonymity online?
Tattoos,https://www.cybersmile.org/cyberbullying-support-community/topic/tattoos_73/,"As i have 4 tattoo's myself i wondered what others thoughts are on tattoos and whether they should be accepted in society as some professions still do not like them. I do agree that some tattoos offensive or otherwise on the face neck etc are a bit much and if your going into certain professions then think about where/what your having...
Any thoughts appreciated"
Have you ever been Cyberbullied on Ask.fm?,https://www.cybersmile.org/cyberbullying-support-community/topic/have-you-ever-been-cyberbullied-on-ask-fm_100/,"If so, what do you think Ask.fm need to do to stop this from happening?!"
Is cyberbullying discussed in your schools/Place of work?,https://www.cybersmile.org/cyberbullying-support-community/topic/is-cyberbullying-discussed-in-your-schoolsplace-of-work_99/,"There are many anti bullying programs out there. Some are in the schools, some are offered in the work place. Many target in person bullying as well as cyberbullying. Have you been involved in a anti bullying program at your school or workplace? Even if it was just a one time discussion, how did you find it? What specifically did you take away from it or what didn't you like about it?
If you could put together your own anti cyberbullying program at your school or even amongst just your friends, what would you discuss or suggests to help them cope with cyberbullying?"
Life without the internet,https://www.cybersmile.org/cyberbullying-support-community/topic/life-without-the-internet_69/,When was the last time anybody had a full 24 hours without access to the internet whatsoever? I can't remember the last time I had no access to a thing online! I think it's scary how much we all rely on the Internet.
If there was one sentence you would use to change or protect social media what would it be?,https://www.cybersmile.org/cyberbullying-support-community/topic/if-there-was-one-sentence-you-would-use-to-change-or-protect-social-media-what-would-it-be_44/,"Imagine if you could change social media or make it safer by saying one sentence, what would be it?"
Cyberbullying alert on MovieStarPlanet- a MMO game for all ages,https://www.cybersmile.org/cyberbullying-support-community/topic/cyberbullying-alert-on-moviestarplanet-a-mmo-game-for-all-ages_101/,"I have played this game for a long time, since it first got launched. At first it didn't have safe chat, and there was a little content that wasn't for children. But in meanwhile, they payed attention to safety too.
And these days I have seen many people quit this game because they have been cyberbullied. Mostly teens were them that were bullied. The reason: because of jealousy. In game there are players that pay for enjoying more benefits. They are also more famous (I mean in-game), and other players often add them as friends and some even use them for gifts and greets. The thing I want to say is that this category of players is more likely to experience bullying. The team of safety on the game doesn't do anything for it. I have seen some messages from those bullies, and they were hurtful.
I would like if cybersmile could do something in that game to decrease this thing happening, like adding a video or something to tell players of that game how worse is cyberbullying."
Should I know my teenage daughters social media passwords?,https://www.cybersmile.org/cyberbullying-support-community/topic/should-i-know-my-teenage-daughters-social-media-passwords_63/,"I've read on various websites that parents should make sure that they know their teenagers passwords to their social media accounts such as Facebook, Twitter and Ask.fm. I've got a couple of problems with this, firstly it feels as though I'm distrusting of my teenage children and not respecting their privacy and secondly I think that if they have anything to hide surely they will just set up another account that I don't know about? I'd like to hear from everybody so I can hear varying opinions if possible."
Dealing with cyberbullying as a parent,https://www.cybersmile.org/cyberbullying-support-community/topic/dealing-with-cyberbullying-as-a-parent_97/,"My daughter is being cyberbullied and it's killing me because I don't know how to make it better for her? I can sense that she is looking to me for help and I don't know what to do. I've contacted Facebook over and over but they won't remove the abusive content. I feel so helpless, help me. How do I speak to a human at Facebook?"
"sleep problems,",https://www.cybersmile.org/cyberbullying-support-community/topic/sleep-problems_89/,"So its about half 3 am here, went to bed a hour and a half ago, just feels like ive had a centuries worth of sleep and idk why. Any ideas?"
A couple of questions! (not bad),https://www.cybersmile.org/cyberbullying-support-community/topic/a-couple-of-questions-not-bad_94/,"Hey guys! Dolphin here and I am back! =) Hope you all had a nice week and weekend! I have a couple of questions!
Since I'm a genius at working powerpoints and I still go to primary school so I thought for Stop cyber bullying day aka Anti-Cyberbullying day,I'v made a little powerpoint about my experiances when I came across me getting cyber bullied and all the info and help I have put into the powerpoint. What have you done? F"
Happy Stop Cyberbullying Day 2015!,https://www.cybersmile.org/cyberbullying-support-community/topic/happy-stop-cyberbullying-day-2015_95/,"Wahoo! It's finally here!
What will you be doing to spread #POSITIVITY online today? We'd love to hear what you're up to!
Remember to use the hashtag #SCD2015 :)"
"What is ""Peer pressure""?",https://www.cybersmile.org/cyberbullying-support-community/topic/what-is-peer-pressure_91/,"You have probably heard this term in this site or somewhere else. Have you ever seen any messages or comments of this form on any site:
""You will die tomorrow if you don't read this, share this text on 10 different pages and you'll be alive."" or ""you won't have luck for 100 years if you don't share this textwith 10 friends"" and same. Don't believe these things, because they are rumours. This is called ""Peer pressure"", and as you've heard, this is also one of the reasons that awakes cyberbullying issues. You have to avoid these messages or comments.
The worst part of "" peer pressure "" is that you never know who started this first. This kind of bullying is spread often on famous sites (especially Facebook or YouTube), but sometimes you can get these messages from a friend that believed the rumor.
Social sites must work to stop ""peer pressure"", and everyone has to avoid these kinds of comments and messages."
Over-Working,https://www.cybersmile.org/cyberbullying-support-community/topic/over-working_92/,"Most of the time I find myself over-working. I get up at 4 AM, get breakfast started for my roomies, then restock the refrigerator, pantry, do the dishes, laundry that accumulated over the day (as I live with 2 others), go to the gym, then I come back and clean the floors, sinks, and counters, basically anything with a surface, then I water the little plants, then I sit down and make lists for everything, chore lists, anticipated grocery lists, and then I study, and don't make it to bed until one. The are gone until midnight, then get up at 7."
People Just Won't Leave Me Alone,https://www.cybersmile.org/cyberbullying-support-community/topic/people-just-wont-leave-me-alone_83/,"I have stopped being friends with a few people for various reasons over the past few months. A few of these people have taken it upon themselves to harrass me online. I have blocked so many accounts on twitter, but they keep making fake accounts and are using one of my pictures for placing on other people's bodies. I don't know what to do anymore."
What are you doing to support Stop Cyberbullying Day? #SCD2015,https://www.cybersmile.org/cyberbullying-support-community/topic/what-are-you-doing-to-support-stop-cyberbullying-day-scd2015_82/,"I'm going to run the British 10k and donate my proceedings to Cybersmile!
I'll also be tweeting at 6pm GMT to make #SCD2015 trend!!
What are you doing?
xx"
One little fun thing to loads of bad things...,https://www.cybersmile.org/cyberbullying-support-community/topic/one-little-fun-thing-to-loads-of-bad-things_86/,I was on roblox having fun! I love to play on roblox high school but thats when i decided to be principal and i had fun acting buts it when that one person changed it. They sweared at me they said i was racist they said i had online S*x i was sexting i was a ugly fat pig and they made me scared by sending me a private message saying if you report me i know were you live and i will kill you. PLEASE HELP!!!
why do people bully almost always the girls?,https://www.cybersmile.org/cyberbullying-support-community/topic/why-do-people-bully-almost-always-the-girls_80/,Well when I DID get bullied I had tons of health problems but since I dont much anymore I just wonder why they practically bully the girls more then boys?
Good parenting in the digital age,https://www.cybersmile.org/cyberbullying-support-community/topic/good-parenting-in-the-digital-age_78/,"It's getting harder and harder to make the right choices as a parent when we are given such limited information about what our teenagers actually do online. The social media they use seems to change so fast and there are constantly warnings in the media about the dangers and tragedy's when the Internet goes bad. I want to make sure I'm the best parent I can be so would appreciate any tips from parents, non parents, teens and whoever's left! How do I know if my children are at risk online? How can I let them know I'm there for them without them feeling I'm prying or not respecting their independence? Looking forward to your help and thanks in advance!"
How can we help cyberbullies?,https://www.cybersmile.org/cyberbullying-support-community/topic/how-can-we-help-cyberbullies_52/,"I know this may not be a popular subject but as I understand it most people who cyber-bully, especially children, are often victims of bullying or abuse that has made them behave this way.
It is easy for someone to hit back and hurt someone using the internet which makes this such a big problem so how can we help them? Treating kids who cyber-bully as criminals is not the answer."
Need some advice again (and thank you!),https://www.cybersmile.org/cyberbullying-support-community/topic/need-some-advice-again-and-thank-you_81/,"Hey everyone!
First of all, I wanted to thank everyone that wished me well and offered support whilst I was in hospital. At a time where I felt, and still feel, very alone; you were all there for me, and I can't stress enough just how important your support was to me. I'm out of hospital now too, thankfully!
I do sort of need some advice though, remember how I said a few weeks ago that I've had some trouble with bullying at college? Well although they aren't calling me names and taking the mick as much, they're all totally excluding me. I spend my time at college, sat alone in class, alone at break and lunch and I just can't help feeling this is my fault. I can't understand why I'm being blanked all of the time, I try so, so hard to act positive and smile and it seems totally pointless. I wish I had someone I could really, really be honest with some, tell them what's really going on in my head, but I'm not sure I can now. No one at college seems to care anymore, it's like they're bored of the fact I do have medical conditions and suffer with my mental health. It seems like it's all old news, boring and Im just a 'drama queen' as I keep being told.
I don't know what to do, I'm sort of scared to speak to anyone accept you guys here, and I don't know what to do really.... If I'm honest I'm scared about how things are going, how my leg keeps getting worse and with that people only block me out more. I get in trouble for being behind on work, bearing in mind I spent however long in hospital, then I've been trying to recover at home. I even went into college yesterday knowing it would make my conditions worse, because I do want to succeed and get better, but no one seems believe that. Even my mum thinks I'm just being lazy....
Sorry I've rambled, this is just the only place I feel safe to say anything.
Thank you again everyone, hope you are all well and are doing okay. Always people around if not :)
Surf x"
Are you or fear that you could be a cyberbully?,https://www.cybersmile.org/cyberbullying-support-community/topic/are-you-or-fear-that-you-could-be-a-cyberbully_179/,"Have you ever wondered if your behaviour online has made you into a cyberbully? Sometimes we can get caught up in our emotions and either mirror a cyberbullies behaviour back at them or for many other reasons we've just started attacking people online.
Sometimes this kind of behaviour is down to the fact we feel angry, lonely and disempowered. We hurt others weaker then us to somehow regain that lost ""power.""
Have you been one of those people and if so, how did you deal with it? Perhaps it's a behaviour you grew out of or wanted to change. But perhaps this is something you aren't sure how to change but would like to.
What has been your experience with the above?"
I'm been cyberbullyed,https://www.cybersmile.org/cyberbullying-support-community/topic/im-been-cyberbullyed_176/,I was seventeen years old went I was first cyberbullyed and now I'm eighteen and I'm still being cyberbulled
Parent s corner,https://www.cybersmile.org/cyberbullying-support-community/topic/parent-s-corner_170/,"I hope it's appropriate to start a chat for parents here. I've seen, there are quite some around.
I'm mum to a teenaged daughter.
I'm very actively underway in cyber space. To me it's important to be well informed about what's going on in our world. And social media has become part of it. I feel I should know at least the basics about that, to be a reliable adviser for my daughter. But I know very few other people of my generation, who think similarly. Much more often I hear, that people of the parent generation are not part of the cyber world and can advise their children only to be careful.
How do you other parents here think about it! Do you feel as informed, as your children are?"
What type of cyberbullying worries you the most?,https://www.cybersmile.org/cyberbullying-support-community/topic/what-type-of-cyberbullying-worries-you-the-most_173/,"As we all know, there is more than one way to bully someone through the use of the internet and smart devices. This can be through email, text, photos, social media accounts, forums, games and other miscellaneous apps.
But which one of these communication tools worries you the most and why?"
Sexting and Cyberbullying what are your thoughts?,https://www.cybersmile.org/cyberbullying-support-community/topic/sexting-and-cyberbullying-what-are-your-thoughts_177/,"As I am sure we have all seen in the news and online, sexting is on the rise among young people. A recent qualitative study done by the NSPCC found the following:
-The primary technology-related threat comes from peers, not 'stranger danger'
-sexting is often coercive
-girls are the most adversely affected
-technology amplifies the problem by facilitating the objectification of girls
-sexting reveals wider sexual pressures
-ever younger children are affected
-sexting practices are culturally specific
-more support and resources are vital to redress the gendered sexual pressures on young people.
PARENTS: What have you found difficult about sexting? Have you spoken to your children about it and if so how did it go?
YOUTH: Have you experienced sexting and cyberbulling or know someone who has? What do you think has worked to address or highlight the issue, be it your school or community organization?
If you feel more needs to be done, what would you like to see happen in your schools or home to better equip you and your friends with the right tools when dealing with sexting?
All thoughts and experiences welcome!"
Back to school and Cyberbullying do you have a plan?,https://www.cybersmile.org/cyberbullying-support-community/topic/back-to-school-and-cyberbullying-do-you-have-a-plan_165/,"It' back to school time! No doubt it's both a welcoming and daunting time.You get to see old friends you haven't seen all summer. Teachers you may have missed and new courses that you may be genuinely looking forward to. But it's also a time of mourning. The summer is now fading behind us and routine sets in. It's also a time to see and hear from people we may not be looking forward to.
Some of you have mentioned on here that you are concerned about returning to school and facing individuals that have previously displayed bullying behavior towards you. Either in person and/or through digital means. With that in mind, and with the time you have spent on here discussing it, reflecting and reading the links- what strategies have you come up with to cope with cyberbullying for the school year?
Please share some of your coping skills as some newer or older members on here may really benefit!
You can also re share some of the great suggestions that have been posted on here already. This is just a great way to put them all in one place to scroll through if someone needs a quick tip.
Happy posting!"
I need some help and advice.,https://www.cybersmile.org/cyberbullying-support-community/topic/i-need-some-help-and-advice_48/,"As I'm only 10 years of age I play on roblox and minecraft but this topic is mainly roblox. I went on it earlier and I got cyberbullied because of my age and people were saying ""dolphins a idiot"" and I said I'm not then I ask are you guys 10 - 19 and they awnsered above 14 but somone said 10 so I felt confident to say mine but then they started teasing me :( I just want to play happily! Not people being mean to me!"
Missing everyone,https://www.cybersmile.org/cyberbullying-support-community/topic/missing-everyone_153/,Hay guys been busy a lot and I missed you guys and I love you guys your like my family <3
How do you cope??,https://www.cybersmile.org/cyberbullying-support-community/topic/how-do-you-cope_167/,"I really want to help my kids prepare for life online but I don't feel like I can offer much in the way of advice because I did not grow up with the internet. I talked with one of my daughters friends about it and she seemed confident and assured about how to deal with online abuse.
I realised that there must be thousands of young people who are armed with their own ways of coping and I think it would be great if we could share them here. If you have any tips or ways that have worked for you please let us know. Thanks :))"
havin problems?,https://www.cybersmile.org/cyberbullying-support-community/topic/havin-problems_168/,i've been havin' probs with being nice all the time because of stress what should I do?
Finally got my motorbike back! :'),https://www.cybersmile.org/cyberbullying-support-community/topic/finally-got-my-motorbike-back_156/,"Ok ok ok, I am so happy to finally say, I have got my motorbike back from the mechanic! Although I still haven't recovered from my accident I am fit enough to ride again. No more being stuck in my stupid little village in the middle of nowhere! XD I have never, ever taxed and insured anything so quickly! I also love the DVLA (for now anyway!) because they've said I don't need a VIC check which got me back on the road a week or two sooner! Let's hope they're system isn't wrong or Imma soo get pulled by the police o.O I literally cannot express how happy I am to have my bike back, and with that, my freedom.
I would like to take the time though just to say, please please watch out for bikers (not that I don't trust you all) :P But everyone makes mistakes when they are in a rush or aren't concentrating. The only reason I was involved in an accident is because one driver failed to look before pulling out onto a main road. No idea how she missed my hi-vis jacket; I look like a poxy glow stick riding down the road haha! It's just important to bear in mind that most riders involved in accidents are not as lucky as I was. I escaped with my life, and somehow (don't know how) escaped serious injury too! I must have a guardian angel somewhere... Please Think Biker :)"
What good thing happened to you today?,https://www.cybersmile.org/cyberbullying-support-community/topic/what-good-thing-happened-to-you-today_75/,"This can be as little as finding £2 in your pocket you didn't know you had, or bigger like passing an Exam you was nervous about.
Today is pay day, Thats my good thing!
What is yours?"
"New to the forum, love helping people. First post, introduction!",https://www.cybersmile.org/cyberbullying-support-community/topic/new-to-the-forum-love-helping-people-first-post-introduction_154/,"I'm very new to cyber bullying and what encompasses the term. I do know what bullying is and how being bullied can make one feel. I have been a victim and a bully, when I was seven years old I was bully. Two years later a ran into the young kid whom I had bullied and apologized, afterwards we even spoke and were friendly towards each other.
One question which always comes to mind whenever anyone takes action, is why. I believe the why is very important and leads to the how. With both one can have completely understanding of the situation, even if you're the victim or the onlooker seeking answers to defuse a situation.
I've some theories I wish to share with the community, i'd love to hear everyone's thoughts.
I believe not all victims seek help due to empathy with their aggressor, it's possible even fear of retaliation is a factor. Is it possible that bullying can come from even those we love? I believe it's possible those we love are the ones we let, hurt us the most. Have you ever noticed how difficult it is to say ""no"" to friends? Imagine how many times your friends ask you for a favor, chances are you want to help your friends and are capable, so you do. Sometimes even at greater cost to ourselves do we help our friends and not say ""no"". It's important to know when and how to say no, no matter whom it is. Imagine how difficult it'd be to say no to a complete stranger, for example homeless people. In theory let's say homeless people are bullies of emotions, and they know how to receive our empathy in their own ways in order to get what they want and achieve their own goals. Well, remember saying no is important and so is helping others, but there's a point in which helping others becomes an abuse to oneself. If I lined up 10 homeless people and you have enough food/money to assist 3 homeless people would you? What about the 4th who saw you giving the the first 3 and so forth? Well the moment you give it's your responsibility to say no when you can no longer give. Once you've said no, know it took strength and courage to say no to someone in need when you yourself couldn't give anymore. Bullies take power and refuse to give it back, make sure you say no to bullies who try to take your power, your courage, and your strength."
