Thread_name,Thread_url,Thread_Content
Why do we put up with bullies?,https://www.cybersmile.org/cyberbullying-support-community/topic/why-do-we-put-up-with-bullies_164/,"There's a many ways to bully someone besides being physical. The one thing all forms of abuse have is your well being, if you're unhappy in a situation or feel wronged by words said by another and feel beaten down my mere glances. Those are possible situations and signs that you might be bullied and putting up with such things lowers our self esteem and with it the respect we feel for ourselves, once our self esteem is lowered through our own eyes that's when a spiral of negativity forms which is nearly inescapable. Like a hurricane taking everything inside and all the ideas within the hurricane a completely mess of destruction and chaos and there's no bright side to it. At that point we open ourselves up to the worst possible scenarios and every word from a bully feels like daggers piercing through your mind, heart, body, and soul leaving you more scarred than ever. That's when it's best to seek an outside perspective, even through a terrible hurricane if seen from the outside can be beauty, imagine an open farm with a bright sunshine gleaming through the skies, and through the clouds. The entire area is full of greens but at the center is a hurricane. It may seem bad, but it's only one spot out of many and if we take a step back to look at the entire seen we can see where we can go without involving ourselves with the hurricane. Sometimes it's easier to deal with the negative than it is to turn it upside down and see the upside of things, but when we do it's a refreshing feeling and it's not always something you can do alone, not if you're stuck in the hurricane. Seek the hand which seek to help you out."
Cyberbullying and Anxiety,https://www.cybersmile.org/cyberbullying-support-community/topic/cyberbullying-and-anxiety_125/,"I wanted to address cyberbullying and anxiety. I know that we have a very helpful thread and article on here,that talks about Cyberbullying and Depression. I thought it may be helpful to also talk about anxiety.
Anxiety can elicit a strong physiological response to a perceived or real threat. It can be debilitating and can put our mind and body through the action of flight or fight.
Cyberbullying can exacerbate anxiety or bring it on. It can make us fear the one thing we found joy in. Be it our Facebook or twitter accounts, our emails and even our phone.
Anxiety can manifest differently in each person, and sometimes it's good to know the variations of how it can creep up on you. Moreover, what to do when it does.
For me, my chest can become very tight and painful. I also feel a tingling sensation all through my body and may feel extreme cold or extremely hot.
For some, Anxiety can cause the heart to race or bring on severe nausea. It can be most unpleasant!
When we are online and facing ongoing bullying we may experience Anxiety. Even after the bullying has ended, we may still feel anxious about going online again.
Have you experienced anxious thoughts and sensations as result of bullying?
We can't always switch off online or want too, so what are some of things you've done to cope? What could you share here, that can help fellow cybersmilers to deal with anxiety?"
Blogger Blackmail,https://www.cybersmile.org/cyberbullying-support-community/topic/blogger-blackmail_161/,What is blogger blackmail? I've just heard it mentioned and I would like to know what it is in case it affects me! I have a feeling it's where bloggers blackmail company owners with bad reviews unless they get free products on websites such as Tripadvisor....is this right?
"i have a friend who,is cyber annoying me",https://www.cybersmile.org/cyberbullying-support-community/topic/i-have-a-friend-whois-cyber-annoying-me_162/,Hi all sorry ur probably getting fed up with all my topics But I have a friend who is cyber annoying me and I want to block her is that ok?
"What music inspires, relaxes or fills you with a positive vibe?",https://www.cybersmile.org/cyberbullying-support-community/topic/what-music-inspires-relaxes-or-fills-you-with-a-positive-vibe_135/,"Sometimes when we are online or playing a game and encounter unkind interactions,` whether towards us or others, it can really put us in a funk. Music can really uplift us and impact our mood in positive ways.
Cybersmile as you know, has some awesome playlists that do just that!
What are some of your favorite songs, artists or genres of music that inspire or uplift you? Your suggestions could help someone out who may need a little boost!"
Returning to schools/colleges....,https://www.cybersmile.org/cyberbullying-support-community/topic/returning-to-schoolscolleges_160/,"Hey,
So I've been away a lot recently but am finally back home for 4 days before going away again but this got me thinking about summer holidays and how often during this time we suffer less cyberbullying as people are busy but often the returning to schools mean for many a daunting time as they are either worried or fear being bullied. I wondered what other people think and whether returning to school or college is making them worry about bullying more?
Melia :)"
BLOCKING PEOPLE ON THE SOCIAL NETS,https://www.cybersmile.org/cyberbullying-support-community/topic/blocking-people-on-the-social-nets_159/,"If someone blocks you on social nets like facebook or twitter,for no specific reason at all,should we call that cyberbulling also? I think that is correct only if someone spams,writes bad or nice private messages too often and similar...to block someone without any reason is rude or it isn't?...okay,if that person doesn't know you in private,is the blocking justified or not ?i think that this kind of treatment is unpolite,at list."
i think I'm. a cyberbully,https://www.cybersmile.org/cyberbullying-support-community/topic/i-think-im-a-cyberbully_158/,Hi all my mate on Facebook said she's hurt herself. I caled her a name is that me being a cyberbully I called her a silly Billy am I a cyberbully for that?
For Teens & Kids: How Do You Want Your Parents to Support You?,https://www.cybersmile.org/cyberbullying-support-community/topic/for-teens-kids-how-do-you-want-your-parents-to-support-you_157/,"This question comes from a parent of a pre-teen boy, who doesn't open up like he used to when he has a negative experience with a friend or fellow student:
If you have been bullied or cyberbullied, how do you want your parents to support or help you?
Do you prefer for your parents to ask you a lot of questions?
Leave you alone to work things out by yourself?
Just be available whenever?
My dilemma as a mom is that if I sense my kid is in any pain or turmoil, I want to find out IMMEDIATELY why and get to a solution as quickly as possible. I am trying to respect him and his needs to decompress, but it's tough to stand by as an observer without doing anything.
If you could tell your mom or dad anything about how you want them to interact with you when there's a problem, what would you tell them?
This would be extremely helpful for me, going into the school year.
Thanks, guys!"
I'm being a cyberbullie to myself,https://www.cybersmile.org/cyberbullying-support-community/topic/im-being-a-cyberbullie-to-myself_151/,Hi guys i'm being cyberbullied again but by me and i can't stop myself saying all the nasty things that are not true wjat should i dp?
How can we get people to be nicer to each other online?,https://www.cybersmile.org/cyberbullying-support-community/topic/how-can-we-get-people-to-be-nicer-to-each-other-online_143/,"It would be so nice to see the internet used for good instead of hearing these horror stories of people being bullied online until they suffer depression, self harm or even commit suicide. When I hear of initiatives that go viral and really help people such as Cybersmile it makes me think how it would be really exciting to see what we coukd all achieve together if we stopped the hating! Has anybody got any ideas what can be done to get people to be nicer to each other online?"
Is there a stigma attached to Cyberbullying?,https://www.cybersmile.org/cyberbullying-support-community/topic/is-there-a-stigma-attached-to-cyberbullying_144/,"I have noticed and you probably have too, that many people don't take cyberbullying seriously. Just today, cybersmile posted in their News section about a media personality who slammed a young Youtube star, accusing her of exaggerating the effects of cyberbullying. She argued, that unless it forces the recipient of the abuse to the brink of suicide, it wasn't really bullying. Cybersmile had this to say to that:
""At Cybersmile, we spend all our time helping victims of digital abuse and understand that there is huge variety in the type of bullying that people experience – as well as their ability to cope with different issues. What might seem like nothing to some people can have a big impact on others and it is short sighted to suggest that being called insults and names should not affect people – or that your suffering is only valid if you feel suicidal.""
I think the above is important to keep in mind. But it does highlight a serious issue. There are people out there who believe that online bullying is not that serious. Some believe as highlighted in the article by Cybersmile, that if you choose to be in the public eye, such as making youtube videos, music, sing or act, then you have to accept all manners of abuse. Which when you think about it, is victim blaming.
I have also heard this being said by some adults concerning young people who are part of the gaming world and social media. Constantly I have heard, ""They should just not go on then!"" or ""They are making a choice playing on a live game where all manners of people are"" and worse still, ""If they post pictures of themselves online, what do you think they should expect?""
The above statements are probably more ignorant than malicious. But it demonstrates that many are not aware of how the changing face of communication is now digitalized and it can't just be avoided.
Our definition of being apart of society or social group, includes the digital world now and that is not going to go away.
Have you encountered this yourself? What do you think could help to better educate those that minimize the effects of cyberbullying?"
summer bullying,https://www.cybersmile.org/cyberbullying-support-community/topic/summer-bullying_152/,ever since summer started for me ive been getting bullied a lot more because there is no school plz help me guys love da kitty :)
i got help from Helpline Online and feeling better from today,https://www.cybersmile.org/cyberbullying-support-community/topic/i-got-help-from-helpline-online-and-feeling-better-from-today_146/,After talking to this guy from Helpline Online there he was so happy to help me out and he like talking to me. we talked over 4 hours in totall i mean i get so distracted and such and he stil was interested in me talking and being honest. i even talked about internet problems i am going through how to deal with blocked and such. i told him i had to go eat so he told me to come back and chat but due to having other coaches i might not get him again i would have to tell them to get his name and be able to talk to him gain. so when i popped in to chat guess what he called my name Koda and told me he popped up and what are the chances that would happen due to having help coaches around the world and his name came up first time try so yea he his been helpful and my suicidal thought and actions stopped for right now so yea i feel happy that he came in and talked through online. so what i am trying to say i am feeling completely better than what i have been all thanks to him from a site that helps with people. Hope I didnt bore anyone on here
Sorry I've been away so long!,https://www.cybersmile.org/cyberbullying-support-community/topic/sorry-ive-been-away-so-long_124/,"Hi all!
Just wanted to say a big hello to everyone as I've not been on here for some time.
Since my motorbike accident and everything I've been so busy with hospitals, lawyers and insurance companies that I've not had much time for anything else!
Mossed you all though and I hope you're all okay.
Also, does anyone know when chat is likely to reopen? Miss it :P
Take care everyone!
Surf"
Fraudulent Emails,https://www.cybersmile.org/cyberbullying-support-community/topic/fraudulent-emails_150/,I'd like to talk about fraudulent emails that we all receive trying to encourage us to click on links. They can appear to be from big companies such as Apple among others but apparently there are some very simple ways to tell that they are scams....can anybody give advice on how to check an email is a scam please? What happens if you accidentally click on the link? Thanks in advance.
How did all you guys find this site?,https://www.cybersmile.org/cyberbullying-support-community/topic/how-did-all-you-guys-find-this-site_116/,"Hi everyone! I'm new and so far, I think this site has been great! I just wanted to ask, How did all of you guys out there find this site? I actually found it from a game called high school story (HSS) and some of the girls out there probably have heard about it. Thx!"
I can't control my anger,https://www.cybersmile.org/cyberbullying-support-community/topic/i-cant-control-my-anger_117/,Hi All the bullying has stopped but i can never control my anger it's getting to the point where i'm lashing out i want to get control how do i do it?
Is it me or something coz i got cyberbullied again!!!,https://www.cybersmile.org/cyberbullying-support-community/topic/is-it-me-or-something-coz-i-got-cyberbullied-again_145/,Hi All again i got cyber bullied by a friend but she's now Blocked Is it a curse on me or something coz I'm getting sick and tired of being cyberbullied on Facebook And she did Threten me first so then i called her a name what should i do now to get over it?
Need some support,https://www.cybersmile.org/cyberbullying-support-community/topic/need-some-support_147/,"Hey guys!
I apologise again for not coming online mich. I'm in hospital so it's been quite difficult to hm get online.
Anyway, I've just found out I'm having an operation this afternoon and I'm really quite nervous. I'm not sure why because I've had 5 already, this one just seems more scary. I just need some advice on how to stay calm I guess.
How are you all anyway? I'd love to hear how you all are xD
Take careee :)
Surf"
i got cyberbullied by a friend on facebook last night,https://www.cybersmile.org/cyberbullying-support-community/topic/i-got-cyberbullied-by-a-friend-on-facebook-last-night_119/,"Hi all
last night i got cyber bullied by a friend on facebook i'm still very angry about it but i have sopken to my teacher at school and my mum how can i stop it happing again?"
Writing an Biography on Richard Armitage,https://www.cybersmile.org/cyberbullying-support-community/topic/writing-an-biography-on-richard-armitage_130/,I am Curious if i am allowed to do that since hes a caring compassionate person. the thing is what i want to know. will people tease me for writing about him
"Dear parents of gamers, part 2 minecraft.",https://www.cybersmile.org/cyberbullying-support-community/topic/dear-parents-of-gamers-part-2-minecraft_87/,"Oh? you're back for more? I mean you probably skipped half the old post and just got to the pointers its what everyone wants to read :P. Anyway this is part two of: Dear parents of gamers, including everyone's (don't quote me on that) favourite game minecraft... I think? in this I will be explaining minecraft, how it works, what goes on in it and a few small ,but important, pointers lets go for round two, *ding* *ding*
- Minecraft, AKA: MC, mc and mincecraft
I was insane for minecraft, playing It since early beta, It was all I talked about for years to come and I spent my life on it.I can't even keep track of all the thousands of hours I spent on it. Now minecraft is an interesting game, the frequent updates (though now somewhat infrequent) give minecraft users a continually changing game to keep them interested. The average age for minecraft is... I don't know man grown men play this game and people who haven't even learnt to walk yet do too. The game has 2 options to play most of the time, single player and multiplayer, singleplayer can be paused, exited and the player is In charge of the world completely. Multiplayer however is where things get confusing. There are things called plugins that alter the servers code and therefor way minecraft works a tad in a multiplayer world. The person(s) who own the multiplayer world use something called a server to run it which is pretty much a really large save file that is either accessed on a website (if you purchased it) and will require a password to access. Or it will be stored in a simple file on your pc. You can run these servers on your pc at the expense of how smooth your game runs or you can purchase one from a company that has many powerful computers dedicated to running servers, now back to plugins, plugins are small altercations to minecraft it might let you stop other plays from destroying your land or It could make TNT radius's bigger. Every server has a different set of rules. It is completely up to the owner to make these, usually the rules are: No swearing, No griefing and be respectful; these rules are enforced by admins/mods or the owner and will ban, temporarily ban, kick or warn ( or of plugins allow anything else, that too) anybody who breaks said rules. Rules however can differ COMPLETELY it is in free will of the server owner to make these so I can't list them all but there are servers that have no rules to near none and those ones are called anarchy servers.
I would advise against anarchy servers due to the fact these are most commonly ones that have vulgarity and is most likely to upset people.
Things parents should know about minecraft:
There are quotes that you may hear often a few being: afk, griefing and pvping. afk stands for Away from keyboard meaning someone is still in the game but idle, grieing means destroying someone else's constructions and pvping stands for player vs playering and is when two or more players engage in combat willingly, or unwillingly, whew what a big pointer heh.
Only on rare occasions will you be unable to leave. Pausing does NOT work on multiplayer.
You can donate to servers and sometimes get in-game 'rewards'. But it only works on the multiplayer world you donated to. So spend wisely.
Not 100% sure what I'll be posting about next but there is A LOT of stuff to cover in minecraft and id sit here all year telling you all the stuff I needed to say so to make it easier for all of us I'm just gonna answer any questions you may have in the comment section below and until next time, stay safe gamers ^_^"
I'm being cyber bullied on Instagram and can't delete my account and I need help.,https://www.cybersmile.org/cyberbullying-support-community/topic/im-being-cyber-bullied-on-instagram-and-cant-delete-my-account-and-i-need-help_138/,"I have never liked Instagram but my friends pretty much pressured me into getting one so I did. I posted a maybe 5 pictures of myself and that was it I never really went on Instagram again. My nickname was something like cream pie or something like that because I really liked coconut cream pie at the time but one of my friends one day texted me and said. ""Dude! You need to look at your Instagram immediately!"" So I tried logging in but I forgot my password so I just hit the ""forgot your password?"" Link and did all the stuff to retrieve a code to reset my password that was going to be sent to my email but I never got the email I kept trying to resend the code then it hit me I typed my email wrong when I signed up! I told my friend that I could not long in so she sent me screen shots of my Instagram comments and things like. ""Hey your a cutie do you have kik?"" ""Hahaha cream pie hahaha!!"" ""Change your name whore!! Hahaha"" ""Your sweet aren't ya? Wanna meet?"" Where Said.. I told my mom because it scared me. She told me she was angry and sad for and at me because I was not allowed to have a Instagram in the first place but she said to not think about it and these people can't find me because I have NO personal information on there but I feel sick to my stomach when I see or hear the word Instagram or see the Instagram logo.. I found this out about 6 months ago but since I can't remove my profile those pics will never go away.. How should I get through this?!"
What are schools doing about cyberbullying,https://www.cybersmile.org/cyberbullying-support-community/topic/what-are-schools-doing-about-cyberbullying_110/,I know cyberbullying and sexting are problems at most schools but what are they doing about it? Some schools seem to have a handle on the issue but some seem completely clueless about what to do. Aren't there any guidelines to help them?
I'm going to be offline,https://www.cybersmile.org/cyberbullying-support-community/topic/im-going-to-be-offline_139/,"I won't visit any online sites, because this year I'm going to another place. I'm going somewhere great for this summer. Just for two weeks, not that long. I think I'll go on 10 or 15 august.
Bye!"
Cyberbullying or arguing?,https://www.cybersmile.org/cyberbullying-support-community/topic/cyberbullying-or-arguing_142/,"Sometimes we can get into heated, even angry debates online, and long after we've stopped replying we may get some upsetting messages in response. Sometimes these messages can be from strangers or friends.
Equally, Cyberbullying can happen either by a friend or a stranger. Sometimes it can be difficult to discern whether we are being cyberbullied or having a very unpleasant argument online. Has this happened to you?
There's a great section under CyberSmile's FAQ section about what cyberbullying is and how there are many different kinds. I urge you to check it out if you haven't already! But what do you constitute as cyberbullying and do you think the difference is important in how we respond or don't respond?"
Vulnerable people receiving gaming consoles and tech this Christmas,https://www.cybersmile.org/cyberbullying-support-community/topic/vulnerable-people-receiving-gaming-consoles-and-tech-this-christmas_225/,"I'm worried about the young and vulnerable receiving consoles, smartphones and other internet enabled tech this Christmas without fully being prepared for what they are going to be exposed to online. I'd imagine it's easy at Christmas for parents to leave their children to plug and play their Playstation or Xbox or start going online with their new laptop without making sure the child is ready, or at least show them Cybersmile if they should need it. This isn't about older teens who are more than capable of dealing with abuse online but I'm thinking more about the fact that younger and younger people are using the Internet through their devices. I'd like to hear what everybody else thinks about this? What age is acceptable to leave your child unattended on the Internet? What about with no experience of the Internet? So many questions!"
Are we potentially engaging in cyberbullying just by sharing?,https://www.cybersmile.org/cyberbullying-support-community/topic/are-we-potentially-engaging-in-cyberbullying-just-by-sharing_219/,"I was recently on Facebook. One of my followers had posted a video that used hidden cameras. The video was of a man ""pranking"" his unaware girlfriend in to thinking he was proposing to her. However, in reality, he declared that he knew she had been cheating on him and broke up with her on camera. This video has been shared thousands of times. I read the comments under the video, Where friends of friends used foul, degrading language about how the girl ""deserved"" it. I was quite disgusted.
These sorts of shaming videos/photos, where the unsuspecting victim is unaware they are being filmed, are on the rise. The comments and posts that follow can be sexist, racist and vulgar. Many of the victims may never even know they were filmed or what is being said about them online. For those that do find out, it can be devastating and life changing.
In saying that, are we complicit in this form of cyberbullying, just by sharing?
If you answered yes, then what can we do to help enlightened our friends or followers that this kind of behaviour is harmful? I was in a position to unfriend this person as I didn't have a close relationship with them but in many cases, it could be your best friend sharing and remarking on these videos. That doesn't necessarily mean they are awful people. We tend to follow the actions of the crowd. So how might you be able to bring this to their attention or how can we collectively, address this issue?"
cant think of a title sorry :) but have a nice awesoem day,https://www.cybersmile.org/cyberbullying-support-community/topic/cant-think-of-a-title-sorry-but-have-a-nice-awesoem-day_220/,i was wondering if people but nagtive stuff towards themselves online just to see someone if they cared
The charity LoL match with Intel and Mark Cuban for Cybersmile,https://www.cybersmile.org/cyberbullying-support-community/topic/the-charity-lol-match-with-intel-and-mark-cuban-for-cybersmile_218/,"I just wanted to say that the charity match in San Jose was absolutely legendary! It was like watching gaming but in the future with everyone happy and enjoying themselves...the bit with Mark Cuban swearing to donate $30000 was hilarious! It was so nice to see a real show, real entertainment with everybody happy and excited. I think Cybersmile being involved contributed greatly to that feeling (or it did for me) so great work guys. Awesome. Did anyone else see it?"
