Thread_name,Thread_url,Thread_Content
"I need help, I don't know what to do. It won't stop.",https://www.cybersmile.org/cyberbullying-support-community/topic/i-need-help-i-dont-know-what-to-do-it-wont-stop_475/,"This guy that harassed me back in 2007 is harassing me again.
a LOT.
I don't understand what to do!
They backed up lots of my posts from other sites onto a Google Drive where they back up my stuff and spread it,
they upload my old vent videos onto youtube as they make fun of me in the comments.
they told me to die on twitter and linked to the google drive folder.
they linked to the google drive folder on Tumblr and keep harassing me.
on instagram they made a hate account dedicated toward me and told their followers to follow me on alt accounts and to send him screenshots of my followers so that he can message them and say bad things about me to them.
And I reported this on all of those social media sites, but none of them do anything. They say its not a violation of their policies. Even with the Google Drive folder and the YouTube videos where they uploaded a lot of my own videos that I posted on twitter and tumblr onto YouTube without my permission in it, YouTube and Google Drive did nothing when I reported them.
How can I deal with this harasser? He's also harassing my friends and followers and blaming it on me. He keeps harassing me every single day now. He told me he knows where I live and that he can call me right now and that he backed up my posts. I don't know how to get this to end! I keep ignoring and blocking and reporting him, but it won't stop."
Instagram anonymous messages,https://www.cybersmile.org/cyberbullying-support-community/topic/instagram-anonymous-messages_454/,"Hi there,
I’m in my 30s and getting cyber bullied for couple of years. It first started when I was a blogger , I deleted profile . After I started my business and now they attacking my business people with who I work and ppl who I know. They keep sending anonymous messages to everyone in Instagram non stop. It’s hurts so bad, I feel like they want me to die. My business brings me good money, but I see a lots of ppl doesn’t want to talk to me anymore. I’m crying every single day and drinking alcohol."
Doxing,https://www.cybersmile.org/cyberbullying-support-community/topic/doxing_473/,"Hi, I was recently doxed by a few people who keyword searched my Twitter and found my use of unsavory language when I was 15. I'm now in my mid-20s. Though I did not use those words with malicious intent, I of course never use them now because I recognize they can be hurtful. These people sent the tweets to my graduate school with the hope that they would rescind my admission. While the school ultimately ruled in my favor, I am now fearful of ever returning to the internet. I have a decent internet following, and I want to do what's right. I want to help promote diversity and inclusion. But now I am afraid to ever go back. I feel like they made me believe something about myself that wasn't true. Can't people change? Will I ever be able to exist in this world without being afraid that people are after me for my past mistakes?"
I feel hopeless right now,https://www.cybersmile.org/cyberbullying-support-community/topic/i-feel-hopeless-right-now_474/,"I've had a group of ppl harassing me for over a year now - I took a stand against a private Facebook page ridiculing local addicts by name, using their pictures with the caption ""Meth or Not"" & just being really cruel. I don't regret standing up for other ppl but I can't have a social media account without insults & innuendos, suggestions that they have videos/pictures of me engaging in sexual acts with partners i had no idea were filming me (if they were). Its completely destroyed my trust in anyone to the point where I have isolated myself from any constant beyond my immediate family. After a couple of relationships that came up out of the blue ended up being recruits of theirs, sent for the soul purpose of getting close to me - to then reveal themselves as yet another tormentor - Im at a loss. I've had my car vandalized but now because I was involved with someone with bad intentions who had access to my devices, there seems to be software running on my phone that affords some level of monitoring/spying & I really just need help. I feel like I sound crazy & I also feel like that's something else that was counted on. Can anyone offer help/resources for me? Thank you in advance."
Stop Cyberbullying Day 2020,https://www.cybersmile.org/cyberbullying-support-community/topic/stop-cyberbullying-day-2020_471/,"Just wondering how this year went with everyone? I noticed a lot of international support from all over the world getting involved on social media to promote the day. Great theme as well, standing up against online hate and abuse while promoting kindness and acceptance."
Internet use during lockdown - are you getting the best out of it?,https://www.cybersmile.org/cyberbullying-support-community/topic/internet-use-during-lockdown-are-you-getting-the-best-out-of-it_459/,"Hi everyone! My first post on the forum, so I thought I would make it an interesting one.
As most of us are probably under some sort of 'lockdown' during the Covid pandemic, I wanted to ask how folks are using the internet and if it is helping you or making things worse?
For me, i'm keeping an eye on the news but not allowing myself to be led too far down extreme opinion routes - such as 'it's 5G's fault' or 'It's being used as a weapon', 'the Chinese did it on purpose' etc etc.
I'm also catching up with friends and family more online and i'm trying to use the internet to connect in a positive way with people. I think it is important to do this. How about you?"
Coping with Cyberbullying,https://www.cybersmile.org/cyberbullying-support-community/topic/coping-with-cyberbullying_457/,"Hi.
This is my first post on this community so I wanted to also take it as a chance to introduce myself.
I am a 14 year old and I am a female. I have autism and anxiety. I have been a victim of cyberbullying, physical bullying and verbal bullying at school for nearly 3 years. :(
I don't know how to cope with all of the cyberbullying. I have tried deleting the group chat but the thoughts of it are whirring through my head making me feel really sad, anxious, hated and worthless.
Sorry for bothering you. Nice to meet you all."
Online bullying,https://www.cybersmile.org/cyberbullying-support-community/topic/online-bullying_452/,"For the last 7 weeks I have been subjected to online abuse on my personal and business profile . Negative reviews placed on my business which have been told to be removed by the police and still harrasing me and anyone who tried to defend my reputation . Was called names like psycho, crazy , deluded and much more which made me feel so depressed . People tell me to stay off social media but my business depends on it . All I want to do is what I love my job making flowers for people x"
Risks to kids online during the coronavirus lockdown.,https://www.cybersmile.org/cyberbullying-support-community/topic/risks-to-kids-online-during-the-coronavirus-lockdown_456/,"I've been reading a lot about the increased risk to kids spending more time online during the 'lockdown' including cyberbullying, hate campaigns, grooming, fraud or phishing scams and also mis-information about the coronavirus such as drinking soap and outlandish conspiracy theories. Has anyone had any problems with any of these issues, or have any concerns?"
Im worried about my daughter joining TikTok,https://www.cybersmile.org/cyberbullying-support-community/topic/im-worried-about-my-daughter-joining-tiktok_455/,"I don't know anything about this site and my 13 year old daughter wants to join as all her friends are using it. Has anyone had any experience with TikTok? Should I be worried and how can I keep her safe?
Any advice would be good."
At School,https://www.cybersmile.org/cyberbullying-support-community/topic/at-school_436/,"Since my sophomore year in high school, I have been targeted by the same girl, no matter where I am at football games, the hallways, at the mall shopping, and now it has escalated to online. She graduated last year, meaning I am a senior. I wanted this year to be amazing: I finally pulled myself out of a dark hole, and I have finally started to accept myself for my flaws. But yesterday, she came back from college with a vengeance. I was at our schools football game and she approached me, yelling derogatory terms at me, ones that should never be used against any female at any age. My friends stood up for me, and I am eternally greatful. But she did it again. Twice in the same night. When she was finally out of sight, I ran to the bathroom and started sobbing. My friends helped me wipe my tears and we went to Waffle House and had a blast. I woke up at 6:00 this morning to multiple messages from my friends, sending me a screenshot of what she posted on her Instagram. It claimed that she did say those things to me, and she was proud of it because it made me cry. She claimed that she told one of my teachers and he agreed with her (that I was a s*** and a crybaby). She did not use my name, but she said that people who want to know who the girl is(me) can dm her for my name and more of the story. I just wanted this to be a good year, and I don't know what to do.
Should I go to administration? Should I involve the teacher that supposedly agree with her? I have witnesses from multiple incidences that can back me up even in court according to my state's anti-bullying laws. My parents want to take this to court, and I just want a non-stressful senior year."
Playground woes,https://www.cybersmile.org/cyberbullying-support-community/topic/playground-woes_453/,"Hello everyone! First time poster alert :-). I'm after some advice please.....
As a lot of parents if school kids will know, parents these days set up parent groups on things like WhatsApp, to make things like school events,parties, remembering homework etc etc much easier.
Well, yesterday morning I asked in our private group (no one is excluded - we are all in there) l, very simply what time all their kids went to bed. Nothing more nothing less.
Throughout the day we all had a very nice chat on there swapping answers etc and everything was fine as it always is.
At school pick up time,I'm then shown(by a kind mum) a screenshot of a PUBLIC facebook post which shows my private WhatsApp mmessage and a vile reply telling me I'm a useless parent,I should be sterslised and I should smother my kids in their sleep to put them out of their misery.
I'm absolutely gutted tbh.
It's been done by one if the school dads who I speak to daily and thought we were friends.
His vile facebook post shows my initials and surname and everything.
I need advice on what to do please.
Part of me wants to ignore out of self preservation but part of me wants to ask him how the hell he could be so mean.
In this day and age I also want to report him.
Its making ne feel so rubbish :-("
SUPPORT COMMUNITY HELP,https://www.cybersmile.org/cyberbullying-support-community/topic/support-community-help_4/,Password problems? Tech troubles? Website woes? If you need help with using the Cybersmile Support Community then let us know in this thread. Welcome!
I don't know what to do anymore,https://www.cybersmile.org/cyberbullying-support-community/topic/i-dont-know-what-to-do-anymore_445/,"So I fell out with someone who knows where I live. They have a website and a Youtube channel that they now use for spreading misinformation, rumors and lies about me and people I both know and don't know. She accuses me of so many things that are not true, it's staggering how misinformed she is. I've reached out online and irl but because we both are in a different country to one another, nobody knows what to do. I tried to ignore it but they keep showing up wherever I go online somehow. I am tired of it but they won't stop."
Sent a nude to a girl who asked me then threatened they was going to find me and arrest me,https://www.cybersmile.org/cyberbullying-support-community/topic/sent-a-nude-to-a-girl-who-asked-me-then-threatened-they-was-going-to-find-me-and-arrest-me_446/,So I remember correctly I was 17 at the time and I was talking to this girls profile on Kik and they eventually asked me to send over an explicit picture of myself and stupidly I agreed. I can't remember how old the profile of the girl was but I'm starting to think this wasn't a real girl as when I sent it they then said they was going to find me and arrest me. I was so scared by this threat I deleted the app straight away of my phone and haven't been back on since. I'm 23 years old now and haven't heard anything from the police either. I'm worried if this was a undercover police officer or someone trying to scam me or blackmail me or something like that. Hope anyone can help me it will be much appreciated I'm really scared and don't want to go to prison
Help with Bullying,https://www.cybersmile.org/cyberbullying-support-community/topic/help-with-bullying_448/,"My daughter is being bullied at school. This weekend 6 girls sent her a picture...they were all sticking up their middle fingers and it read “when the whole squad hates the same bitch”.
The person who took the picture (without the title of course) was a mother of one of the girls. Since she is an adult helping to bully a 12 year old girl is there anything legally I can do?"
My cyberbullying experience,https://www.cybersmile.org/cyberbullying-support-community/topic/my-cyberbullying-experience_443/,"Hi, my online name is Charlie or Nat, I don't like giving out my personal name on stuff
I'm going to tell you my experiences on a website called Quotev. It's a quiz website and were you can also make fanfiction and make friends. But when I joined, it was all but toxity.
Me and my online friends that I met on there have to keep our 'mouths' closed. Because we can't say anything that'll possibly offend anyone. And I don't mean offend like racial stuff. But I met if you dare accidentally call someone a dude when they are a girl and we had no clue. We then get attacked, like we get these things called call-out journals. The journals are made to get the bad people off, such as people that support something that is illegal. But the journals can be overused
I've made my mistakes on this website, some I didn't know the full story or I didn't know the full topic. I've gotten call outs all the time. The people that make the call out journals use screenshots, within the screenshot, it's just them over reacting or they took it the completely the wrong way. There has actually been one accusing thing that drove me up the wall.
What happened in the call-outs that weren't necessary, was that the mean stuff the people would say, and all the sexual comments. Like we're talking about some disgusting stuff. And I am not telling you guys because you shouldn't see nor hear it.
There is also people that have multiple accounts, they use to gather information. Like they can act like they're on your side, but in reality they're not. I know that is bullying right there, but when I try to tell the people, they say it's all right. So blocking will not work.
I have some mental and health issues, I am not your typical late teenager. I have autism and such and when I say that, they say I'm lying, they say that they are autistic and they are better than me.
There is also the way your profile has to look. It has to be astethic and stuff. And if you don't want your profile to look bland, well good luck on the website.
Note: There is definitely more stories about this website, but I just want to put this out there. I made it very bland because the examples that I would've used would be disgusting, offensive, and rude. And it's NOT 'You are stupid' it's worse.
Thank you for reading my story, and hopefully the cyberbullying will stop all together, on not just the website but with ALL websites. Thanks again."
Tips on how to forgive,https://www.cybersmile.org/cyberbullying-support-community/topic/tips-on-how-to-forgive_439/,"I was bullied within the club sport I did for 5 years straight. It’s been about a year now since I’ve quit and have tried to move on. I can’t find peace and I don’t know how to forgive these people who caused me pain. I still see these people in public, and I have panicked responses. I know healing can take a while, but a few tips on how to move on would be nice."
Bullying,https://www.cybersmile.org/cyberbullying-support-community/topic/bullying_442/,I have recently moved to a new area about a year ago. And this year I have had so many problems with the school from cussing my child out to making other kids bully her. I have call all the way up to the state board and nothing is being dune except them being meaner to her. I need advice on who I can speak to.
Younow an unsafe place for people with special needs/autism,https://www.cybersmile.org/cyberbullying-support-community/topic/younow-an-unsafe-place-for-people-with-special-needsautism_440/,"I'd like to tell ya'll about my unfortunate time on the broadcasting site YouNow I have used that site since late 2014 it was fun at for a while, over the next 2 years I made lots of friends, then starting in 2017 things changed and the drama started more and more broadcasters started seeing their fans as a form of income from tips and less human, a long since gone broadcaster I was friends with all of a sudden turned on me because I didn't have the money to tip, when I told her I was on disability she turned around and did everything but cuss me out telling me a real fan would have a real job and money to tip. So I got mad, and instead of flipping out, I told her about my aspurgers and depression she turned around and blocked me from her broadcast saying she didn't need people like me in her broadcast, she only wanted people smart enough to keep up. so because I was very hurt and really only had one friend from the site I could talk to I left, leaving behind a lot of people I felt safe with. For about 5 months I stayed off the site floating from chat site to chat site just to have someone to talk to, I missed my connections with some of the broadcasters from younow so I made a new account, I was welcomed back better than I could have hoped for, so for a while I felt safe again, that was up until April 2019, Autism awareness/mental health became topic, which at first I thought was a good idea a topic I could guest with someone and tell my story, man was I wrong, only a very few broadcasters talked on the subject, and a lot of the ones who didn't said things like ""not my problem"" ""people are just begging for attention and trying to get me to feel sorry for them"" many broadcasters made fun of people with ptsd by repeating may times during a broadcast ""oh I can't say that I might trigger someone"" or when they were guesting with someone else or in a another broadcast they would repeat ""you can't do that or you can't say that I might get triggered"" this went on for a couple of months then people started leaving for other sites, which wrong or right I liked because I could feel safer and more welcome with the ones I watched. I was wrong again a lot of broadcaster treated me kindly and with respect but one broadcaster took it upon himself to start blocking autistic people, he did this to many of them, he made a blanket statement where he claimed because they couldn't always understand what he was talking about that all we ever were was a distraction to his broadcast. I tried to let my feelings go because I had other friends on the site, when I was calm about the statements that were made I went back to his broadcast to my surprise less than a week ago he replayed a clip I didn't know about on his broadcast in said clip he was talking to another broadcaster where he told her special needs people are just a disruption to YouNow and if he could he'd get them off the platform because the site had no need for them. when I heard that I cried because this broadcaster I felt safe watching felt so harshly about special needs people. So I left again, on the urging of a very close friend who is a broadcaster that I knew and talked to off site I made a new account with a new name she wanted me in her broadcast because she told me I always made her feel special and could help keep drama out of her broadcasts, I did, with this new account I was hidden and safe, I've been sticking to mainly to her broadcasts.when she wasn't on I would stop into broadcasts of someone of the ones I once watched. one of my friends is also autistic and left the same time I did but never made a new account. I was happy just sitting back watching the few I did while not being noticed, come to find out tonight while I was in a broadcast of one that I felt closest to I heard her and her guest she was streaming with making fun of the reason I left, I guess she thought another screen name was me because she turned around and said I know who you are and I know why you left, you couldn't handle the site, and that if I knew I was part of the problem I should have left along time ago, tonight I also found out the very broadcaster that made statements about special needs people told his viewers that autistic people trigger him and that he doesn't need them in his stream and had block a lot of people. To sum this up the best I can I feel that if you have any type of disability YouNow is a very toxic environment, they will find any way to make you feel different, in the way and a joke, I've tried reporting many broadcasters for the way they treat people to the mods only to get an email back saying that YouNow sees no problem with what the broadcasters are saying, they have even gone as far as to ban my account for three days for reporting a Partnered broadcasters (one who gets a paycheck and splits the profits from tips with the site) Younow has always treated the ones who bring in the money like they can do no wrong. The site in the past few months has become more and more about broadcasters taking shots at a certain number of tips, females who make their broadcast as sexually suggestive as they can with in the rules which are never enforced when its a partnered broadcaster , adult males watching and guesting young children while making lewd comments. over all this should be an 18+ site. I strongly suggest parents keep their children off the site not only for their personal safety (some how people can get numbers and addresses of users and leak them to people) but for their mental health keeping them from seeing just how cruel the world can be at such a young age.....I'm not the best of writers but if you made it this far thank you P.S. I still keep to the broadcast of the one friend who made me feel the safest and most loved in her own special way, for all she's been through with me I feel the least I can is be there for her like she is for me and to say thank you"
Facebook Moderators suffering from stress?,https://www.cybersmile.org/cyberbullying-support-community/topic/facebook-moderators-suffering-from-stress_437/,Just read some reports about out-sourced moderator teams who are suffering from PTSD like symptoms because of the images they are employed to block or take down. I am stunned that humans are doing this because you would need millions of people to do this effectively. Even more stunned that they have not used their incredible resources to engineer AI or smart tech to address this.
Should Fornite be banned?,https://www.cybersmile.org/cyberbullying-support-community/topic/should-fornite-be-banned_430/,"Iv'e been reading about calls for Fortnite to be banned because it is harmful to kids. Fortnight is about as harmful as Sponge Bob IMO. Are we going to start banning TV shows, films, art, or music that someone thinks is 'harmful'? I understand that too much of anything can be harmful and internet addiction is a real thing, but games are an essential part of growing up and should be left alone. Thoughts anyone?"
Getting things off IG,https://www.cybersmile.org/cyberbullying-support-community/topic/getting-things-off-ig_435/,"I've reported endlessly things that were posted to shame me, things of my past. Nothing has gotten removed, it's been nearly a year. What next?"
What are your thoughts on the new Facebook Reactions?,https://www.cybersmile.org/cyberbullying-support-community/topic/what-are-your-thoughts-on-the-new-facebook-reactions_193/,Do you think its a better alternative to a dislike button!?
