Thread_name,Thread_url,Thread_Content
Who is listening??,https://www.cybersmile.org/cyberbullying-support-community/topic/who-is-listening_62/,"I am seeing a lot of money being spent on organisations with so called ""experts"" talking about online safety etc but who is actually listening to them? They seem to be patting themselves on the back for setting up their own organisations but my kids have never heard of them and are not interested in being lectured and made to feel like they are stupid. What are they actually doing apart from spending money and talking to each other??? At least Cybersmile offer contact with young advisors for young people in trouble."
Safety on social media,https://www.cybersmile.org/cyberbullying-support-community/topic/safety-on-social-media_51/,Which safety policies could be introduced to social media to make it safer for everybody? Is there any that exist that work that could be used on other platforms/social networks?
Safe Gaming Community,https://www.cybersmile.org/cyberbullying-support-community/topic/safe-gaming-community_46/,"As we all know abuse in gaming is increasing and it's ruining it for us that care about being threatened with rape, murder and lots of other vile things. So... I think we should work with Cybersmile to create a safe gaming community where ""nice"" people can interact with other ""nice"" people. I've mentioned this in a couple of topics and people seemed to think it's a good idea so here's my input! Would love your thoughts and ideas?..."
What did you want to be when you we're younger VS now?,https://www.cybersmile.org/cyberbullying-support-community/topic/what-did-you-want-to-be-when-you-were-younger-vs-now_49/,"When I was around 10 I wanted to be an English teacher, I did good in English and I wrote loads of stories, I thought English meant just writing stories until I went to secondary school and realized it was actually a lot more complicated than it sounded, I quickly changed my dream career.
Right now, I want to be a custody Sargent, The people who book you into the cells when you've been detained. Either this or a 999 Dispatcher.
Are you currently in Employment, What are you doing...is it what you want to be doing? Remember not to give away too many personal details. We need to keep everything safe on here"
Introductions....,https://www.cybersmile.org/cyberbullying-support-community/topic/introductions_26/,"Hey guys, so I am new to this website, I noticed there isn't a thread where we can introduce ourselves. So I thought id start one. <3
My name is Claire, I work full time with children and I love my job. I also do lots of volunteering in my free time, and I love helping out where I can. I have been cyberbullied myself so I can understand and relate to how difficult it is being in that situation, but you can get through it. Stay strong <3
Look forward to getting to know you all."
What is your dream/hope?,https://www.cybersmile.org/cyberbullying-support-community/topic/what-is-your-dreamhope_30/,"So, I was thinking why don't we all share one dream for this year? One thing we want to achieve, it could be something really small and simple such as going to school every day for a week if that's something you struggle with or maybe doing your best in exams or something similar. I thought it's something we could do and then look back on them to see that we've achieved something! It may also be a good thing to set yourself a date to do this by like I have with one of mine.
Often we forget about the achievements and dreams we had when things get hard, so I'll start and please feel free to share them on the thread, it would be great to support one another with our dreams! :)
Dreams-
1) My dream/hope is to get reasonable grades in all my AS exams hopefully all C's/D's at least and a Distinction in production.
2) Also I hope to start training for the half marathon by the 1st June and start running further distances (2 miles)
3) To start more volunteering with young people and children ready for university, and have done at least 25 hours by the end of june.
So there are my dreams and hopes..... what are yours? :)
'The future belongs to those who believe in the beauty of their dreams' :)"
Distractions?,https://www.cybersmile.org/cyberbullying-support-community/topic/distractions_31/,"Hi :).
Hope your all ok?
I was wondering if anyone knew any good distractions where you can begin to calm down/take your mind of things ?
Been struggling abit with these recently.
Thank you.
Heather xx"
Should The Schools Monitor The Students Computer Usage More Closely,https://www.cybersmile.org/cyberbullying-support-community/topic/should-the-schools-monitor-the-students-computer-usage-more-closely_35/,From what I saw when I was in school when we went to computer lab the people that sat near me I always caught them on facebook when they were done with their work. Or for those that didn't care about their school work they were on facebook anyways. I think that they should find someway to be able to see what every student is doing on the computers that way they can cut down on the cyberbullying at school. Does anyone else think this should be a thing? ^_^
Thank you!,https://www.cybersmile.org/cyberbullying-support-community/topic/thank-you_56/,"As I'm sure most of you know, I am in hospital at the moment.
I just wanted to thank you all for sharing your advice and all your support. It's really nice to know there are people about who care. I wasn't sure about this site when I was first told about it, I honestly thought it would bring up too many feelings about BeatBullying. But coming on here was one of the best decisions of my life, and I really mean that.
So I just wanted to say thank you to all the users, moderators, advisors and staff. You've all been awesome and have certainly made this hospital stay a tad more bearable.
P.S. Thanks to Cybersmile HQ for the get well soon meme in the positivity shrine (everyone should totes check it out!)
Hope you're all okay! :)
Surf"
Play minecraft?,https://www.cybersmile.org/cyberbullying-support-community/topic/play-minecraft_57/,I think I solved a problem about bullying on minecraft I use my boyfriend's account now and he has a boy skin and I didn't get bullied once today so im going to play on it more often to see if I get bullied on it anymore! love you guys
I need some help on a Story I have to write,https://www.cybersmile.org/cyberbullying-support-community/topic/i-need-some-help-on-a-story-i-have-to-write_59/,Ok so I need a 20pg story about some interesting story can you guys help me???? love you guys
I'm really worried about bullying,https://www.cybersmile.org/cyberbullying-support-community/topic/im-really-worried-about-bullying_47/,"Hi everyone,
OK so basically I've been having trouble with some girls at college... they're spreading rumours about me and telling the staff I plan on quitting college (total lie). So the stag have gone mad at me and called my mum who has also gone mad.
Now my medical conditions have got out of control so I'm am waiting for an ambulance. They're all going to find out about this and be really horrible about it... They always spread stuff around about my xonditions"
Hi im Getting bullied on skype how can i stop it??,https://www.cybersmile.org/cyberbullying-support-community/topic/hi-im-getting-bullied-on-skype-how-can-i-stop-it_45/,So this boy calls me bad names and tells me to go die what should I do??
Tips for creating strong passwords,https://www.cybersmile.org/cyberbullying-support-community/topic/tips-for-creating-strong-passwords_55/,"We all know how important having strong passwords is for all our different social media accounts, but nobody warned us how hard it was going to be to create (and remember) good, memorable, and safe passwords! On here we would like everyone to contribute their tips on how to create the strongest passwords and remember them (without giving too many secrets away!)"
Online Identity Theft,https://www.cybersmile.org/cyberbullying-support-community/topic/online-identity-theft_50/,"I get really worried about somebody setting up various social media accounts with my name and picture on and doing really bad stuff, I mean what's to stop them? It could ruin my future career : ("
it's personal but I know you guys are kind and won't spread it =),https://www.cybersmile.org/cyberbullying-support-community/topic/its-personal-but-i-know-you-guys-are-kind-and-wont-spread-it_54/,"I've been staying quite late recently due to me getting cyber bullied and my sister. We are very (both of us) scared to tell our mum. Inv not been concentrating well in class because off me bEing kept awake. And I'm going into year 6 and my teacher says go to bed earlier. I do but it does not work now she's getting angry at me =(
Please help me!"
Positive story share!,https://www.cybersmile.org/cyberbullying-support-community/topic/positive-story-share_7/,"I'd love to hear all about your stories about overcoming online abuse!
:)"
chat room,https://www.cybersmile.org/cyberbullying-support-community/topic/chat-room_53/,when is that chat room on here open ?
Stop Cyberbullying Day,https://www.cybersmile.org/cyberbullying-support-community/topic/stop-cyberbullying-day_43/,With stop cyberbullying day right around the corner (June 19th) I thought I'd start this topic so we can all share ideas about what we can do on the day to raise awareness of online bullying and help spread positivity all over the world! Any ideas anyone?
What is the best way to deal with cyberbullying?,https://www.cybersmile.org/cyberbullying-support-community/topic/what-is-the-best-way-to-deal-with-cyberbullying_10/,"Hi, I'm a mother and carer and wondered what everybody else thought was the best way to deal with a teenager who's being cyberbullied? I don't know whether to talk to her or speak with one of her friends and ask them to speak with her?
Any help with this would be greatly appreciated x"
How can we protect ourselves on social media?,https://www.cybersmile.org/cyberbullying-support-community/topic/how-can-we-protect-ourselves-on-social-media_37/,Hey so I thought it would be a good idea to see how you all would protect yourself on social media platforms? How would you protect yourself against things like sexting?
Sexting,https://www.cybersmile.org/cyberbullying-support-community/topic/sexting_42/,Sexting is all over the news and is worrying me as a parent. What is sexting and how do I know if my children and doing it?
Why do girls get so much abuse on games?,https://www.cybersmile.org/cyberbullying-support-community/topic/why-do-girls-get-so-much-abuse-on-games_41/,My eldest daughter has had to delete her profile and re-join an online game because of the abuse she got for being a girl. Is this common among online games? I am so shocked because she love the game and is really good so I can't understand why she is treated so badly. She is now back but afraid to give any clues to her gender to avoid abuse. Is it just the game she is on? (League of Legends) or is this true for other games as well?
Should Young people be warned quicker about this? E.g spam viruses cyber bullying other gamers.,https://www.cybersmile.org/cyberbullying-support-community/topic/should-young-people-be-warned-quicker-about-this-e-g-spam-viruses-cyber-bullying-other-gamers_36/,Ok everyone in my year / year above has been warned about this! Not year 4 3 2 or 1 !! I think this is serious and should be sorted! When I was in year 4 played minecraft went on roblox. Talked to other people. Strangers. Year 3 Did exactly the same went on social websites. Year 2 I think this is the appropriate time to warn them because their going to start going on the web and looking around. Spam. Soming might come up on a website saying you won a million pounds they click it BAM Computer gone! And minecraft is popular and I think they would start looking at that and bam! They are young and there are old people on minecraft there age out in public and they will get bullied! Please talk to each other and let's sort this problem!
Keep Positivity App! What do you guys think???,https://www.cybersmile.org/cyberbullying-support-community/topic/keep-positivity-app-what-do-you-guys-think_28/,you so should develop a positivity app jam packed with positivity for each day. and be able to make your own positivity shrine and be able share it with friends in need. its a social networking app for the ones who need it the most. im sure you'll have the community behind you. i'd like to see what ideas the community has to say about the idea! share your ideas!
hi:-),https://www.cybersmile.org/cyberbullying-support-community/topic/hi_16/,"Hi!!
During the ages of 11-14 I was being bullied online. Mostly on MSN. Yes I know... Its very old, but it did use to be popular lol:).. Anyway, there was two people, he use to send me nasty messages, call me names, and make me feel very vunrable. I never told anyone at first, I thought it was my fault, like I caused it. Looking back now I know I didn't. Due to me not telling anyone, it was making my school life, and home very difficult. I got angry, kicked off at people, skipped so many classes. Thinking I wasn't 'normal'. My friend realised something wasn't right , I shown her some of the messages I was getting. My friend got me too speak to my geography teacher. I was terrified. In the end it got sorted , I had so much support from school and other agencies. It took me a while to get my trust in people back and to get myself back on my feet. I got here in the end. Some of you may remember the sites BB and MF, they did a lot to help me.
II'm very thankful for this new site. Love it already. #posotivity as cybersmile would say. . <3
Heather x"
Should cyberbullying be against the law?,https://www.cybersmile.org/cyberbullying-support-community/topic/should-cyberbullying-be-against-the-law_14/,I was wondering what everybody else thought about cyberbullying and abuse online and wondered if you thought it should be made illegal?
Prosecuting cyberbullies,https://www.cybersmile.org/cyberbullying-support-community/topic/prosecuting-cyberbullies_6/,There seems to be no justice for people who are targeted by bullies online. I think if we saw more prosecutions for this kind of behaviour then it would put people off doing it. Young people especially should be more responsible with how they use the internet and treat each other online.
Hi i'm new,https://www.cybersmile.org/cyberbullying-support-community/topic/hi-im-new_115/,Hi everyone i'm new here
I got cyberbullied again,https://www.cybersmile.org/cyberbullying-support-community/topic/i-got-cyberbullied-again_140/,"Hi guys As i've probley Metiond b4 i've been cyber bullied again by another friend from school first it started with nasty messages and then it got wprse she posted another nasty ,esaage but on a photo that my foster mum tagged me in on facebook what can i do i'm at witts end ilm thing about de activing my facebook account but i still the evedence to show the teachers when i got back to school sorry bout the spelling i'm not very good"
Will cyberbullying get worse in the future?,https://www.cybersmile.org/cyberbullying-support-community/topic/will-cyberbullying-get-worse-in-the-future_134/,I wonder if cyberbullying is going to get worse in the future? I mean people are using the Internet and social media younger and younger so it would make sense that the problem is going to get worse. What do you think?
Gaming tournament,https://www.cybersmile.org/cyberbullying-support-community/topic/gaming-tournament_121/,"Today I saw an announcement about a gaming tournament happening in my town. The tournament is about an action game, where participants have to create a team from 5 players. I really want to take part in that tournament, but there are a little problems.
The game. I haven't played it for 5 years (since I changed my PC operative system to Windows7). I have forgotten few things like weapon shortcuts and places. That isn't very big problem as there I have a friend who can help me remind the game.
The other problem is- my town seems hasn't got any gamer girls. And the worst is that there's no girl that plays the action game. So I would feel uncomfortable to be the only girl there.
But in the other side I like the main price. Entry fee isn't very expensive too.
Should I join the tournament?"
Should we even have social media,https://www.cybersmile.org/cyberbullying-support-community/topic/should-we-even-have-social-media_131/,what i am saying should we have any games or social media taht would talk to another person from another computer. as it causes problems right now
Chatroulette Blackmail,https://www.cybersmile.org/cyberbullying-support-community/topic/chatroulette-blackmail_128/,I've heard some disturbing stories of people being blackmailed into sexual activity or into paying money on Chatroulette. Has anybody heard about this? If so what should we do? I don't use Chatroulette but I'm worried for people I know who aren't very wise online. Thanks for the help.
How do I protect my online reputation???,https://www.cybersmile.org/cyberbullying-support-community/topic/how-do-i-protect-my-online-reputation_126/,"If someone wanted to spread rumours about me or discredit my reputation online how could I stop that from happening? I know of people who have been ruined by malicious campaigns for little or no reason. It could be a family member, friend, business associate or a random troll, but what could you do if it happened to you? Are we all vulnerable?"
I am New and been cyberbullied this week,https://www.cybersmile.org/cyberbullying-support-community/topic/i-am-new-and-been-cyberbullied-this-week_127/,I have hard time talking about my problems to people what should i do
What has happened to you over the Internet?,https://www.cybersmile.org/cyberbullying-support-community/topic/what-has-happened-to-you-over-the-internet_118/,"Hi everyone! Iv never been cyber bullied, but I want to be prepared for if it does happen. What has happened to you, and how did you deal with it? Answering this question would be a great help! Thanks!"
Bulling,https://www.cybersmile.org/cyberbullying-support-community/topic/bulling_120/,Amo esta pagina... El dia de hoy impartiremos con mis compañeros universitarios un taller sobre el bulling a niños que trabajan en las calles y con su esfuerzo logran estudiar... Realmente apoyo que este tema sea conocido por todos! Y me alegra que esta fundacion se encargue de ayudar a tantas personas!!
Help! Two of my friends misunderstood about cyberbullying issue I told them.,https://www.cybersmile.org/cyberbullying-support-community/topic/help-two-of-my-friends-misunderstood-about-cyberbullying-issue-i-told-them_122/,"It all happened after midnight and so on. The time was 3:00 am. Many scientists know that this time the brain can't control things, especially thoughts when it comes to saying anything.
I was texting a friend on phone. It was time for bed and I told him I was going offline. But he didn't let me, by saying that he had something ""important"" to say. We started an arguement, because he was saying that he wanted to send hurtful messages to my best friend. I told him not to do it, and he kept saying some of hurtful messages he wanted to say at my best friend. This went so long (it was late too). I really couldn't control things I said in that moment, and I started ""hurting"" him by calling him with swear words. And I told him that it was cyberbullying. He asked me what was that, I told him when you say bad things to a friend on messages. Then he asked ""like what?"". At that moment I really shouldn't have told him this thing. I told him something bad about his girlfriend, like we are fighting on internet. Then when I got less angry, I saw everything that I did. I told him not to tell his girlfriend about it, because it was late, my mind wasn't clear. He replied only that he will see about that.
Few days later, the same friend told me to see what happened on a group conversation. It was on the group where my classmates talk to each other. I saw that someone there ruined the conversation by saying bad words. My friend said "" maybe you should cyberbully him"".
This is very bad. Now he thinks cyberbullying is fun.
Things went worse when his girlfriend, which is one of my closest friends, told me that she saw all the messages. She was really mad at me, but because she was my close friend, she just warned me not to talk to his boyfriend ever again. I told her that I won't.
Then few months later. He messaged me again. I told him to delete all messages and never talk to me again. He replied that he won't and he laughed.
Another day. His girlfriend got very mad. I really shouldn't believed him. I told her that I didn't try to do anything bad, but unfortunately she started to send me hurtful messages like ""you stupid idiot"", ""go fall from your balcony and die"". So she thought cyberbullying is just a joke too. The messages didn't hurt me at all, I just hated the fact I made an enemy, from a big misunderstanding. I told her I was sorry to do it again, because he messaged me first. Then she told me it was her idea. I promised I will never ever text message with him. But she said that she will let me text with him only when she will take out the thing I told him from her mind. I asked her if she was angry with me, she said no.
Now the girl has lost faith on me. And the guy isn't a bad person, only that he doesn't know what is cyberbullying. They both think that it's a joke, so how to convince them what really is cyberbullying?"
"As a teenager who spends a lot of time on the Internet, I feel cyber bullying isn't mentioned often enough.",https://www.cybersmile.org/cyberbullying-support-community/topic/as-a-teenager-who-spends-a-lot-of-time-on-the-internet-i-feel-cyber-bullying-isnt-mentioned-often-enough_102/,"All types of social media these days are against bullying, but I have mixed views on this. It's often for me to come across a post where someone is being called names ect, and the so
cial media is doing nothing about it.
I feel as if cyber bullying isn't mentioned enough these days. Especially in Schools. I want a way of promoting positive things over the Internet, aimed directly at the victims...but social media's still don't have something like this.
What do you think about social media's and their bullying situations? Do you think it's mentioned enough?"
When does cyberbullying become harassment?,https://www.cybersmile.org/cyberbullying-support-community/topic/when-does-cyberbullying-become-harassment_113/,It's my understanding that one of the laws that protect us from being abused online is harassment laws. I wondered when does online abuse become harassment and how bad does it need to be before we can get the Police involved?
New Cybersmile Ambassadors,https://www.cybersmile.org/cyberbullying-support-community/topic/new-cybersmile-ambassadors_84/,"It's amazing that Fifth Harmony and Richard Armitage have both been announced as official Cybersmile Ambassadors and have joined the Cybersmile movement for positivity online! I'd like to talk about who else we would like to see join the movement and become Cybersmile Ambassadors, who would you like to see join and why?"
Cyberbullying affects males too,https://www.cybersmile.org/cyberbullying-support-community/topic/cyberbullying-affects-males-too_112/,I think it's important to recognise that cyberbullying/online bullying affects boys and men just as badly as it does girls and women. I know statistics shows that girls are a little bit more likely to be affected but I still think it's important that we keep the conversation alive around the problems males face online because otherwise men/boys will start becoming uncomfortable talking about their problems. What are your thoughts?
"Do you want to have a career in the online video game industry? If so, what career?",https://www.cybersmile.org/cyberbullying-support-community/topic/do-you-want-to-have-a-career-in-the-online-video-game-industry-if-so-what-career_103/,"If you're a woman, do you think you'd be ridiculed?"
If you could convey one positive message to a bully what would it be?,https://www.cybersmile.org/cyberbullying-support-community/topic/if-you-could-convey-one-positive-message-to-a-bully-what-would-it-be_96/,"Sometimes we may encounter online bullying that is very hard to shut off from. It could be that it's being perpetrated by someone from our school or workplace or someone who is part of an online community we are active in.
If you HAD to respond, what is one positive and potential helpful thing you could say to them?
Now, if you can't or choose not to respond (sometimes that is better) What positive message would you have liked to convey to them? Sometimes writing it down in a journal or as a letter ( that is never sent) can help with the anger and pain we feel after experiencing bullying. I know that has worked for me. Changing a negative experience into a positive, means that we have taken the power back from the person who is trying to bring us down.
It's pretty empowering!
What would you say to them if you could?"
What social media site do you prefer the most and feel the safest using?,https://www.cybersmile.org/cyberbullying-support-community/topic/what-social-media-site-do-you-prefer-the-most-and-feel-the-safest-using_109/,"There are so many social media sites out there I couldn't even name them all. But just to name a few, Facebook, twitter,Tumblr, Pinterest, Kik, Ask.fm, WhatsApp,LinkedIn, etc... When it comes to limiting cyberbullying which one do you find has worked better for you? Moreover, if you have never experienced cyberbullying, how have you used your favorite social media that may have helped reduce/eliminate the threat of trolls and bullying?"
